[
  {
    "slug": "azad-malard",
    "name": {
      "fa": "دانشگاه آزاد ملارد",
      "en": "Malard Azad University"
    },
    "type": "azad",
    "location": {
      "fa": "تهران",
      "en": "Tehran"
    }
  },
  {
    "slug": "azad-neyshabur",
    "name": {
      "fa": "دانشگاه آزاد نیشابور",
      "en": "Neyshabur Azad University"
    },
    "type": "azad",
    "location": {
      "fa": "نیشابور",
      "en": "Neyshabur"
    }
  }
]
